{
  "schema_version": "0.1.0",
  "decision_id": "3c9e1f2a-7b4d-4e8a-9c1f-2a3b4c5d6e70",
  "actuator": "proxy",
  "decided_at": "2026-10-08T14:03:12.418Z",
  "mode": "shadow",
  "policy_version": "policy_v12",
  "episode": {
    "kind": "harness_prompt",
    "session_id": "sess_7f3a91",
    "prompt_id": "prompt_0042"
  },
  "attempt_id": "0f5c2a8e-3b1d-4c6e-9a7f-1d2e3c4b5a60",
  "route": {
    "route_id": "route_main_classifier",
    "route_type": "classifier"
  },
  "input_features": {
    "request_class": "main",
    "requested_model": "claude-opus-5-5",
    "turn_index": {
      "value": 0,
      "evidence": "measured"
    },
    "context_tokens": {
      "value": 18432,
      "evidence": "measured"
    },
    "tool_calls_in_context": {
      "value": 0,
      "evidence": "measured"
    },
    "tool_errors_in_context": {
      "value": 0,
      "evidence": "measured"
    },
    "consecutive_bad_turns": {
      "value": 0,
      "evidence": "measured"
    }
  },
  "decision_model": {
    "provider": "anthropic",
    "model_id": "claude-haiku-4-5",
    "model_version": "claude-haiku-4-5-20251001",
    "call_attempt_id": "6a1b2c3d-4e5f-4a6b-8c7d-9e0f1a2b3c4d"
  },
  "decision_model_output": {
    "type": "choice",
    "selected": "fast",
    "probabilities": [
      {
        "option": "fast",
        "probability": "0.82"
      },
      {
        "option": "deep",
        "probability": "0.18"
      }
    ],
    "provider_confidence": null
  },
  "escalation": null,
  "experiment_arm": null,
  "chosen_target": {
    "provider": "anthropic",
    "model": "claude-sonnet-4-5",
    "tier": "fast"
  }
}
